{
  "schema_version": "oae.v0.1",
  "episode_id": "codex_session_20260406_a3f8e1",
  "capture_class": "HASH_ONLY",
  "replay_class": "BEST_EFFORT",
  "profiles": [],

  "identity": {
    "producer": {
      "kind": "cli",
      "name": "codex-cli",
      "version": "0.1.2",
      "vendor": "openai"
    },
    "operator": {
      "mode": "human",
      "handle": "thaserjian"
    },
    "agent": {
      "model": "o3"
    }
  },

  "instruction": {
    "surfaces": [
      {
        "kind": "AGENTS_MD",
        "path": "AGENTS.md",
        "sha256": "1a2b3c4d5e6f1a2b3c4d5e6f1a2b3c4d5e6f1a2b3c4d5e6f1a2b3c4d5e6f1a2b",
        "scope": "repo"
      },
      {
        "kind": "AGENTS_MD",
        "path": "src/pipeline/AGENTS.md",
        "sha256": "2b3c4d5e6f1a2b3c4d5e6f1a2b3c4d5e6f1a2b3c4d5e6f1a2b3c4d5e6f1a2b3c",
        "scope": "directory"
      }
    ],
    "effective_digest": "3c4d5e6f1a2b3c4d5e6f1a2b3c4d5e6f1a2b3c4d5e6f1a2b3c4d5e6f1a2b3c4d"
  },

  "events": [
    {
      "event_id": "evt_001",
      "ts": "2026-04-06T10:30:00.000Z",
      "kind": "SESSION_START",
      "summary": "Codex CLI session started in auto mode"
    },
    {
      "event_id": "evt_002",
      "prev_event_hash": "4d5e6f1a2b3c4d5e6f1a2b3c4d5e6f1a2b3c4d5e6f1a2b3c4d5e6f1a2b3c4d5e",
      "ts": "2026-04-06T10:30:01.000Z",
      "kind": "USER_PROMPT",
      "summary": "User: add retry logic to the pipeline ingestion step"
    },
    {
      "event_id": "evt_003",
      "prev_event_hash": "5e6f1a2b3c4d5e6f1a2b3c4d5e6f1a2b3c4d5e6f1a2b3c4d5e6f1a2b3c4d5e6f",
      "ts": "2026-04-06T10:30:08.000Z",
      "kind": "FILE_WRITE",
      "summary": "Created src/pipeline/retry.py (47 lines)"
    },
    {
      "event_id": "evt_004",
      "prev_event_hash": "6f1a2b3c4d5e6f1a2b3c4d5e6f1a2b3c4d5e6f1a2b3c4d5e6f1a2b3c4d5e6f1a",
      "ts": "2026-04-06T10:30:12.000Z",
      "kind": "FILE_WRITE",
      "summary": "Edited src/pipeline/ingest.py: added retry wrapper"
    },
    {
      "event_id": "evt_005",
      "prev_event_hash": "1a2b3c4d5e6f1a2b3c4d5e6f1a2b3c4d5e6f1a2b3c4d5e6f1a2b3c4d5e6f1a2b",
      "ts": "2026-04-06T10:30:20.000Z",
      "kind": "TEST_RUN",
      "summary": "pytest tests/ — 34 passed, 0 failed"
    },
    {
      "event_id": "evt_006",
      "prev_event_hash": "2b3c4d5e6f1a2b3c4d5e6f1a2b3c4d5e6f1a2b3c4d5e6f1a2b3c4d5e6f1a2b3c",
      "ts": "2026-04-06T10:30:22.000Z",
      "kind": "SESSION_END",
      "summary": "Session complete. 2 files changed."
    }
  ],

  "artifacts": [
    {
      "type": "GIT_COMMIT",
      "sha256": "7a8b9c0d1e2f7a8b9c0d1e2f7a8b9c0d1e2f7a8b9c0d1e2f7a8b9c0d1e2f7a8b",
      "metadata": {
        "commit": "def5678abc1234",
        "message": "feat: add retry logic to pipeline ingestion"
      }
    },
    {
      "type": "FILESET",
      "sha256": "8b9c0d1e2f7a8b9c0d1e2f7a8b9c0d1e2f7a8b9c0d1e2f7a8b9c0d1e2f7a8b9c",
      "metadata": {
        "files_changed": ["src/pipeline/retry.py", "src/pipeline/ingest.py"],
        "lines_added": 52,
        "lines_removed": 3
      }
    }
  ],

  "evidence": {
    "redactions": []
  },

  "verification": {
    "integrity": "N_A",
    "claims": "N_A",
    "verifier": {
      "name": "oae-self-report",
      "version": "0.1.0"
    },
    "exit_code": 0,
    "notes": "No external verifier ran. Instruction surface digest is self-reported by producer."
  },

  "replay_hints": {
    "repo": "https://github.com/example/pipeline-service",
    "commit": "def5678abc1234",
    "commands": [
      "codex --full-auto 'add retry logic to the pipeline ingestion step'"
    ],
    "environment": {
      "codex_mode": "full-auto",
      "node_version": "20.11.0"
    }
  }
}
