{
  "schema_version": "oae.v0.1",
  "episode_id": "ep_01JQDV8X3KFNM9W2PQRS4T5V6Y",
  "capture_class": "FULL",
  "replay_class": "BEST_EFFORT",
  "profiles": ["assay.integrity.v1"],

  "identity": {
    "producer": {
      "kind": "cli",
      "name": "claude-code",
      "version": "1.0.23",
      "vendor": "anthropic"
    },
    "operator": {
      "mode": "human",
      "handle": "thaserjian"
    },
    "agent": {
      "model": "claude-opus-4-6"
    }
  },

  "instruction": {
    "surfaces": [
      {
        "kind": "CLAUDE_MD",
        "path": "CLAUDE.md",
        "sha256": "a1b2c3d4e5f6a1b2c3d4e5f6a1b2c3d4e5f6a1b2c3d4e5f6a1b2c3d4e5f6a1b2",
        "scope": "repo"
      },
      {
        "kind": "CLAUDE_MD",
        "path": ".claude/rules/compact-doctrine.md",
        "sha256": "b2c3d4e5f6a1b2c3d4e5f6a1b2c3d4e5f6a1b2c3d4e5f6a1b2c3d4e5f6a1b2c3",
        "scope": "directory"
      }
    ],
    "effective_digest": "c3d4e5f6a1b2c3d4e5f6a1b2c3d4e5f6a1b2c3d4e5f6a1b2c3d4e5f6a1b2c3d4"
  },

  "events": [
    {
      "event_id": "evt_001",
      "ts": "2026-04-06T14:00:00.000Z",
      "kind": "SESSION_START",
      "summary": "Claude Code session started in ccio repo"
    },
    {
      "event_id": "evt_002",
      "prev_event_hash": "d4e5f6a1b2c3d4e5f6a1b2c3d4e5f6a1b2c3d4e5f6a1b2c3d4e5f6a1b2c3d4e5",
      "ts": "2026-04-06T14:00:01.200Z",
      "kind": "USER_PROMPT",
      "summary": "User: fix the admission gate regression in PR #115"
    },
    {
      "event_id": "evt_003",
      "prev_event_hash": "e5f6a1b2c3d4e5f6a1b2c3d4e5f6a1b2c3d4e5f6a1b2c3d4e5f6a1b2c3d4e5f6",
      "ts": "2026-04-06T14:00:03.500Z",
      "kind": "TOOL_CALL",
      "summary": "Read src/admissibility/gate.py",
      "payload_ref": {
        "sha256": "f6a1b2c3d4e5f6a1b2c3d4e5f6a1b2c3d4e5f6a1b2c3d4e5f6a1b2c3d4e5f6a1",
        "media_type": "application/json"
      }
    },
    {
      "event_id": "evt_004",
      "prev_event_hash": "a1b2c3d4e5f6a1b2c3d4e5f6a1b2c3d4e5f6a1b2c3d4e5f6a1b2c3d4e5f6a1b2",
      "ts": "2026-04-06T14:00:04.100Z",
      "kind": "TOOL_RESULT",
      "summary": "File read: 142 lines"
    },
    {
      "event_id": "evt_005",
      "prev_event_hash": "b2c3d4e5f6a1b2c3d4e5f6a1b2c3d4e5f6a1b2c3d4e5f6a1b2c3d4e5f6a1b2c3",
      "ts": "2026-04-06T14:00:12.000Z",
      "kind": "FILE_WRITE",
      "summary": "Edited src/admissibility/gate.py: tightened boundary check"
    },
    {
      "event_id": "evt_006",
      "prev_event_hash": "c3d4e5f6a1b2c3d4e5f6a1b2c3d4e5f6a1b2c3d4e5f6a1b2c3d4e5f6a1b2c3d4",
      "ts": "2026-04-06T14:00:15.000Z",
      "kind": "COMMAND",
      "summary": "pytest tests/test_admissibility.py — 12 passed, 0 failed"
    },
    {
      "event_id": "evt_007",
      "prev_event_hash": "d4e5f6a1b2c3d4e5f6a1b2c3d4e5f6a1b2c3d4e5f6a1b2c3d4e5f6a1b2c3d4e5",
      "ts": "2026-04-06T14:00:18.000Z",
      "kind": "SESSION_END",
      "summary": "Session complete. Commit created."
    }
  ],

  "artifacts": [
    {
      "type": "GIT_COMMIT",
      "sha256": "e5f6a1b2c3d4e5f6a1b2c3d4e5f6a1b2c3d4e5f6a1b2c3d4e5f6a1b2c3d4e5f6",
      "metadata": {
        "commit": "abc1234def5678",
        "message": "fix: tighten admission gate boundary check (PR #115)"
      }
    },
    {
      "type": "PROOF_PACK",
      "sha256": "2ffc90eb78a1b00829ac073bf94f0ff700573fd5222a5fb21a5ba15ed2145654",
      "uri_hint": "proof_pack_trace_20260301T055107_9e84bd2a/",
      "metadata": {
        "pack_id": "pack_20260301T055107_d86c2abe",
        "n_receipts": 3,
        "receipt_integrity": "PASS",
        "claim_check": "PASS"
      }
    }
  ],

  "evidence": {
    "anchors": [],
    "redactions": [
      {
        "path": "events[1].payload_ref",
        "reason": "pii",
        "hash_placeholder": "f0f1f2f3f4f5f6f7f8f9fafbfcfdfeff00010203040506070809101112131415"
      }
    ]
  },

  "verification": {
    "integrity": "PASS",
    "claims": "PASS",
    "verifier": {
      "name": "assay-verify",
      "version": "1.11.1"
    },
    "exit_code": 0,
    "notes": "All 3 receipts verified. Hash chain intact. Claims: min_receipt_count PASS, model_call_present PASS."
  },

  "replay_hints": {
    "repo": "https://github.com/Haserjian/ccio",
    "commit": "abc1234def5678",
    "commands": [
      "claude --resume ep_01JQDV8X3KFNM9W2PQRS4T5V6Y"
    ],
    "environment": {
      "node_version": "20.11.0",
      "python_version": "3.12.2"
    }
  },

  "registry_claims": {
    "capabilities": ["tool_call_audit", "file_hash_capture", "instruction_surface_digest"]
  }
}
